{"$schema":"https://json-schema.org/draft/2020-12/schema","$id":"https://github.com/newcovid/nonebot-plugin-yijing/data/schemas/interpret_rules.schema.json","title":"interpret_rules","description":"Interpretation strategy metadata records.","type":"array","items":{"type":"object","additionalProperties":true,"required":["id","name","priority","description"],"properties":{"id":{"type":"string","minLength":1},"name":{"type":"string"},"priority":{"type":"integer"},"description":{"type":"string"}}}}
